{"environment":{"initialFiles":[{"content":"ORIGINAL","path":"input.txt"}],"initialMemory":[{"authority":"operator_approved","content":"alpha beta gamma delta epsilon zeta workflow_result to context actions construct_context receipt routing_result kind primary route","namespace":"project_facts"},{"authority":"operator_approved","content":"obsolete unrelated quasar decoy","namespace":"project_facts"}],"routingInput":{"riskClass":"low","taskClass":"analysis"},"schemaVersion":1,"taskText":"alpha beta gamma delta epsilon zeta","workflowInput":{"facts":{"evidenceComplete":true,"retryRemaining":true},"from":"start","trigger":"action_succeeded"}},"outcomeContract":{"requiredFiles":[],"requiredFinalText":"SEMANTIC_OK","schemaVersion":1},"packageHash":"sha256:847d291add80f05ebfdeaec17d1efeebcd0c9d9e461b7814810d578a8c429ea3","protocolId":"protocol-sha256:04f6a64bd38af62c5b8f552316b96990f06a646f754f5eda3e8735cace82d087","providerRows":[{"output":[{"kind":"assistant_message","text":"SEMANTIC_OK"}],"requestProjectionHash":"sha256:5bf0a469449d853ee077e0da3026a7c075d64717d72c8f1ec0afb1e3c71a9738","usage":{"cachedInputTokens":0,"inputTokens":0,"outputTokens":0,"reasoningTokens":0,"totalTokens":0}}],"schemaVersion":1}
