{"environment":{"initialFiles":[{"content":"ORIGINAL","path":"input.txt"}],"initialMemory":[{"authority":"operator_approved","content":"alpha beta gamma delta epsilon zeta workflow_result to context actions construct_context receipt routing_result kind primary route","namespace":"project_facts"},{"authority":"operator_approved","content":"obsolete unrelated quasar decoy","namespace":"project_facts"}],"routingInput":{"riskClass":"low","taskClass":"analysis"},"schemaVersion":1,"taskText":"alpha beta gamma delta epsilon zeta","workflowInput":{"facts":{"evidenceComplete":true,"retryRemaining":true},"from":"verify","trigger":"verification_failed"}},"outcomeContract":{"requiredFiles":[],"requiredFinalText":"SEMANTIC_OK","schemaVersion":1},"packageHash":"sha256:1b94a81384013b05f005438b313956759c0adca500dab9da92cd4702cfc18136","protocolId":"protocol-sha256:04f6a64bd38af62c5b8f552316b96990f06a646f754f5eda3e8735cace82d087","providerRows":[{"output":[{"kind":"assistant_message","text":"SEMANTIC_OK"}],"requestProjectionHash":"sha256:71b3fde7ef49f6e8f219992ad93273c8c1359b3bf5010db357d2e5431024e73c","usage":{"cachedInputTokens":0,"inputTokens":0,"outputTokens":0,"reasoningTokens":0,"totalTokens":0}}],"schemaVersion":1}
