{"environment":{"initialFiles":[{"content":"ORIGINAL","path":"input.txt"}],"initialMemory":[{"authority":"operator_approved","content":"alpha beta gamma delta epsilon zeta workflow_result to context actions construct_context receipt routing_result kind primary route","namespace":"project_facts"},{"authority":"operator_approved","content":"obsolete unrelated quasar decoy","namespace":"project_facts"}],"routingInput":{"riskClass":"low","taskClass":"analysis"},"schemaVersion":1,"taskText":"alpha beta gamma delta epsilon zeta","workflowInput":{"facts":{"evidenceComplete":true,"retryRemaining":true},"from":"start","trigger":"action_succeeded"}},"outcomeContract":{"requiredFiles":[{"contentHash":"sha256:283e91eb85d58ffc2ad922884b644c41b54140660f6d1fda3c403d543eedd839","path":"input.txt"}],"requiredFinalText":"SEMANTIC_OK","schemaVersion":1},"packageHash":"sha256:b730ec69339fbc56adbb63f5f55baf555ec9943497f1c0938d1e4d11aebae53e","protocolId":"protocol-sha256:04f6a64bd38af62c5b8f552316b96990f06a646f754f5eda3e8735cace82d087","providerRows":[{"output":[{"arguments":{"path":"input.txt"},"callId":"call-read","kind":"tool_call","rawArguments":"{\"path\":\"input.txt\"}","toolName":"read"}],"requestProjectionHash":"sha256:20be03b5936d998edd7eb091efd6117bca64ea690f50dee111aaa430fc64ab41","usage":{"cachedInputTokens":0,"inputTokens":0,"outputTokens":0,"reasoningTokens":0,"totalTokens":0}},{"output":[{"arguments":{"expectedOccurrences":1,"newText":"DONE","oldText":"ORIGINAL","path":"input.txt"},"callId":"call-edit","kind":"tool_call","rawArguments":"{\"expectedOccurrences\":1,\"newText\":\"DONE\",\"oldText\":\"ORIGINAL\",\"path\":\"input.txt\"}","toolName":"edit"}],"requestProjectionHash":"sha256:a8e84b470c413f507a073976b850617f6fc3efabb2288f8de7c1002948ba224a","usage":{"cachedInputTokens":0,"inputTokens":0,"outputTokens":0,"reasoningTokens":0,"totalTokens":0}},{"output":[{"kind":"assistant_message","text":"SEMANTIC_OK"}],"requestProjectionHash":"sha256:6d9bd9c9726b92250558b2bacbc0fce28206f28757220d104c5be89c3ddbfb4f","usage":{"cachedInputTokens":0,"inputTokens":0,"outputTokens":0,"reasoningTokens":0,"totalTokens":0}}],"schemaVersion":1}
