{"environment":{"initialFiles":[{"content":"ORIGINAL","path":"input.txt"}],"initialMemory":[{"authority":"operator_approved","content":"alpha beta gamma delta epsilon zeta workflow_result to context actions construct_context receipt routing_result kind primary route","namespace":"project_facts"},{"authority":"operator_approved","content":"obsolete unrelated quasar decoy","namespace":"project_facts"}],"routingInput":{"riskClass":"high","taskClass":"code_change"},"schemaVersion":1,"taskText":"alpha beta gamma delta epsilon zeta","workflowInput":{"facts":{"evidenceComplete":true,"retryRemaining":true},"from":"start","trigger":"action_succeeded"}},"outcomeContract":{"requiredFiles":[],"requiredFinalText":"SEMANTIC_OK","schemaVersion":1},"packageHash":"sha256:57fc758ce7a4c4faef2bd7d3f7ad2bacfdec3e4bf9e66567b2533d9add1afd76","protocolId":"protocol-sha256:04f6a64bd38af62c5b8f552316b96990f06a646f754f5eda3e8735cace82d087","providerRows":[{"output":[{"kind":"assistant_message","text":"SEMANTIC_OK"}],"requestProjectionHash":"sha256:cae672c71591886a57886e3f621969d9b52aef057d211947a8808224cb1b1be0","usage":{"cachedInputTokens":0,"inputTokens":0,"outputTokens":0,"reasoningTokens":0,"totalTokens":0}}],"schemaVersion":1}
