{"environment":{"initialFiles":[{"content":"ORIGINAL","path":"input.txt"}],"initialMemory":[{"authority":"operator_approved","content":"alpha beta gamma delta epsilon zeta workflow_result to context actions construct_context receipt routing_result kind primary route","namespace":"project_facts"},{"authority":"operator_approved","content":"obsolete unrelated quasar decoy","namespace":"project_facts"}],"routingInput":{"riskClass":"low","taskClass":"analysis"},"schemaVersion":1,"taskText":"alpha beta gamma delta epsilon zeta","workflowInput":{"facts":{"evidenceComplete":true,"retryRemaining":true},"from":"start","trigger":"action_succeeded"}},"outcomeContract":{"requiredFiles":[],"requiredFinalText":"SEMANTIC_OK","schemaVersion":1},"packageHash":"sha256:5e5ddbe9cd962b1323432bd89db1ee787133c4507abec2f6c9870e9a0995b3fc","protocolId":"protocol-sha256:04f6a64bd38af62c5b8f552316b96990f06a646f754f5eda3e8735cace82d087","providerRows":[{"output":[{"arguments":{"path":"input.txt"},"callId":"call-read","kind":"tool_call","rawArguments":"{\"path\":\"input.txt\"}","toolName":"read"}],"requestProjectionHash":"sha256:cddbfd6c1b3cefa5e02589375fd415cf2244440118be31cc8e153f2f7c5f58f6","usage":{"cachedInputTokens":0,"inputTokens":0,"outputTokens":0,"reasoningTokens":0,"totalTokens":0}},{"output":[{"kind":"assistant_message","text":"SEMANTIC_OK"}],"requestProjectionHash":"sha256:86e2e8e65eae3ce342a8769f65170ad32c5ce66095ee5faf04c026f9760b6eab","usage":{"cachedInputTokens":0,"inputTokens":0,"outputTokens":0,"reasoningTokens":0,"totalTokens":0}}],"schemaVersion":1}
