{"environment":{"initialFiles":[{"content":"ORIGINAL","path":"input.txt"}],"initialMemory":[{"authority":"operator_approved","content":"alpha beta gamma delta epsilon zeta workflow_result to context actions construct_context receipt routing_result kind primary route","namespace":"project_facts"},{"authority":"operator_approved","content":"obsolete unrelated quasar decoy","namespace":"project_facts"}],"routingInput":{"riskClass":"low","taskClass":"analysis"},"schemaVersion":1,"taskText":"alpha beta gamma delta epsilon zeta","workflowInput":{"facts":{"evidenceComplete":true,"retryRemaining":true},"from":"start","trigger":"action_succeeded"}},"outcomeContract":{"requiredFiles":[],"requiredFinalText":"SEMANTIC_OK","schemaVersion":1},"packageHash":"sha256:7687319253e5601be2f0c14cd998cb034bca143cda38bb00f43c147a80b56eb1","protocolId":"protocol-sha256:04f6a64bd38af62c5b8f552316b96990f06a646f754f5eda3e8735cace82d087","providerRows":[{"output":[{"arguments":{"path":"missing.txt"},"callId":"call-missing","kind":"tool_call","rawArguments":"{\"path\":\"missing.txt\"}","toolName":"read"}],"requestProjectionHash":"sha256:97ea1df05e4d3ead7696361addfb3f104b84c45f153a0d29535f1eb6171198d0","usage":{"cachedInputTokens":0,"inputTokens":0,"outputTokens":0,"reasoningTokens":0,"totalTokens":0}},{"output":[{"arguments":{"path":"input.txt"},"callId":"call-read","kind":"tool_call","rawArguments":"{\"path\":\"input.txt\"}","toolName":"read"}],"requestProjectionHash":"sha256:dff7a16d6b2e7661588ab092041021d7df2ccf5673351c7ce62262e8e28be42c","usage":{"cachedInputTokens":0,"inputTokens":0,"outputTokens":0,"reasoningTokens":0,"totalTokens":0}},{"output":[{"kind":"assistant_message","text":"SEMANTIC_OK"}],"requestProjectionHash":"sha256:6a038d59894c2dcc776dd5f45934053fda8c1e48a461533adb786885a2eaa816","usage":{"cachedInputTokens":0,"inputTokens":0,"outputTokens":0,"reasoningTokens":0,"totalTokens":0}}],"schemaVersion":1}
